{
  "$schema": "https://json-schema.org/draft/2020-12/schema",
  "$id": "https://github.com/suchipizza/DeskMenace/schema/config.schema.json",
  "title": "gary.js configuration",
  "description": "Configuration for inline JSON, data-config files and Gary.init(). Unknown or invalid fields are ignored with a console warning.",
  "type": "object",
  "additionalProperties": false,
  "properties": {
    "$schema": { "type": "string" },
    "schemaVersion": { "const": 1 },
    "enabled": { "type": "boolean", "default": true },
    "character": { "description": "Character manifest URL.", "type": "string", "minLength": 1 },
    "preset": { "description": "Name of a ready-made set of lines, scenes and triggers offered by the character (its manifest's \"presets\"). Options the page sets itself win over the preset.", "type": ["string", "null"], "pattern": "^[A-Za-z0-9][A-Za-z0-9_-]{0,39}$" },
    "behaviours": { "type": "array", "items": { "$ref": "#/$defs/behaviour" } },
    "behaviors": { "type": "array", "items": { "$ref": "#/$defs/behaviour" } },
    "packs": { "description": "Line pools used for ambient chatter.", "type": "array", "items": { "$ref": "#/$defs/poolName" }, "default": ["core"] },
    "lines": {
      "description": "Line pools merged by name with the character's own pools (a pool given here replaces the character's pool of the same name).",
      "type": "object",
      "propertyNames": { "$ref": "#/$defs/poolName" },
      "additionalProperties": {
        "type": "array",
        "items": {
          "oneOf": [
            { "type": "string", "minLength": 1, "maxLength": 500 },
            { "type": "object", "required": ["text"], "additionalProperties": false, "properties": { "text": { "type": "string", "minLength": 1, "maxLength": 500 }, "weight": { "type": "number", "minimum": 0 } } }
          ]
        }
      }
    },
    "vars": {
      "description": "Values for {name} placeholders in lines. {site} defaults to the page's hostname.",
      "type": "object",
      "propertyNames": { "pattern": "^[A-Za-z][A-Za-z0-9_]{0,31}$" },
      "additionalProperties": { "type": ["string", "number"] }
    },
    "triggers": { "description": "Replaces the default triggers.", "type": "array", "items": { "$ref": "#/$defs/trigger" } },
    "scenes": { "description": "Named sequences of steps that triggers (\"scene\") and Gary.do(name) can play.", "type": "object", "maxProperties": 50, "propertyNames": { "$ref": "#/$defs/poolName" }, "additionalProperties": { "$ref": "#/$defs/scene" } },
    "entrance": { "description": "Scene played instead of the usual entrance. Start it with an \"enter\" step.", "$ref": "#/$defs/poolName" },
    "dropTo": { "description": "After a drag: \"floor\" falls to the bottom of the screen, \"here\" lands where it was let go.", "enum": ["floor", "here"], "default": "floor" },
    "surfaces": { "description": "CSS selector of page elements the character may wander onto and stand on. Elements with a data-gary-surface attribute always qualify.", "type": ["string", "null"], "minLength": 1, "maxLength": 500 },
    "limits": {
      "type": "object",
      "additionalProperties": false,
      "properties": {
        "minGapSeconds": { "type": "number", "minimum": 0, "maximum": 3600, "default": 20 },
        "maxLinesPerMinute": { "type": "number", "minimum": 0, "maximum": 30, "default": 2 }
      }
    },
    "position": {
      "type": "object",
      "additionalProperties": false,
      "properties": {
        "side": { "enum": ["left", "right"], "default": "right" },
        "y": { "description": "Height of the usual entrance: the body's middle as a fraction of the screen height. Default: the bottom of the screen.", "type": ["number", "null"], "minimum": 0, "maximum": 1 },
        "x": { "description": "Ambient walks stay between these fractions of the screen width.", "type": "array", "minItems": 2, "maxItems": 2, "items": { "type": "number", "minimum": 0, "maximum": 1 }, "default": [0, 1] }
      }
    },
    "height": { "description": "Rendered frame height in CSS px, overriding the character's default.", "type": ["number", "null"], "minimum": 40, "maximum": 1000 },
    "announce": { "description": "Announce speech bubbles to screen readers.", "type": "boolean", "default": false },
    "ambient": { "description": "Random walks, glances and chatter while idle.", "type": "boolean", "default": true },
    "pace": { "description": "How often ambient behaviour happens. \"busy\" wanders a lot.", "enum": ["calm", "normal", "busy"], "default": "normal" },
    "restAfter": { "description": "Seconds without visitor input after which the idle animation pauses to save CPU. 0 never rests.", "type": "number", "minimum": 0, "maximum": 86400, "default": 30 },
    "quality": { "description": "Artwork sharpness when the character offers several image sizes: auto matches the screen, standard always loads the smallest images, high always the sharpest.", "enum": ["auto", "standard", "high"], "default": "auto" },
    "menu": {
      "type": "object",
      "additionalProperties": false,
      "properties": {
        "credit": {
          "oneOf": [
            { "const": false },
            { "type": "object", "required": ["label", "url"], "additionalProperties": false, "properties": { "label": { "type": "string", "minLength": 1, "maxLength": 60 }, "url": { "type": "string" } } }
          ]
        }
      }
    },
    "zIndex": { "type": "integer", "minimum": 0, "maximum": 2147483647 }
  },
  "$defs": {
    "behaviour": { "enum": ["enter", "walk", "idle", "judge", "say", "drag", "react-clicks", "leave"] },
    "poolName": { "type": "string", "pattern": "^[A-Za-z0-9][A-Za-z0-9_-]{0,39}$" },
    "steps": { "type": "array", "minItems": 1, "maxItems": 20, "items": { "$ref": "#/$defs/sceneStep" } },
    "scene": {
      "oneOf": [
        { "$ref": "#/$defs/steps" },
        {
          "type": "object",
          "required": ["steps"],
          "additionalProperties": false,
          "properties": {
            "steps": { "$ref": "#/$defs/steps" },
            "interrupted": { "description": "Line or #pool said when a drag interrupts the scene; the scene then carries on.", "type": "string", "minLength": 1, "maxLength": 500 }
          }
        }
      ]
    },
    "fraction": { "type": "number", "minimum": 0, "maximum": 1 },
    "sceneStep": {
      "description": "One step with exactly one action: walkTo, say, play or wait.",
      "type": "object",
      "oneOf": [{ "required": ["walkTo"] }, { "required": ["say"] }, { "required": ["play"] }, { "required": ["wait"] }, { "required": ["enter"] }, { "required": ["exit"] }],
      "additionalProperties": false,
      "properties": {
        "walkTo": {
          "description": "A CSS selector (walks to the element and stands on it), \"floor\", or a point on the screen as fractions { x, y } (y: the body's middle).",
          "oneOf": [
            { "type": "string", "minLength": 1, "maxLength": 500 },
            { "type": "object", "minProperties": 1, "additionalProperties": false, "properties": { "x": { "$ref": "#/$defs/fraction" }, "y": { "$ref": "#/$defs/fraction" } } }
          ]
        },
        "enter": { "description": "Appears just outside this edge of the screen (start of a scene).", "enum": ["left", "right"] },
        "y": { "description": "With enter: the body's middle as a fraction of the screen height (default 0.5).", "$ref": "#/$defs/fraction" },
        "on": { "description": "With enter: walk in level with the first matching element that has room.", "type": "string", "minLength": 1, "maxLength": 500 },
        "exit": { "description": "Walks off this edge of the screen and stays away.", "enum": ["left", "right"] },
        "at": { "description": "Where on the element to stop.", "enum": ["center", "left", "right", "random"] },
        "say": { "description": "A line, or #pool.", "type": "string", "minLength": 1, "maxLength": 500 },
        "play": { "description": "Clip role to play once, e.g. judge, judge.pointer, idle.variant.", "type": "string", "pattern": "^[a-z][a-z0-9.-]{0,40}$" },
        "wait": { "description": "Seconds to stand still.", "type": "number", "minimum": 0, "maximum": 60 }
      }
    },
    "trigger": {
      "type": "object",
      "required": ["on"],
      "anyOf": [{ "required": ["say"] }, { "required": ["do"] }, { "required": ["scene"] }],
      "additionalProperties": false,
      "properties": {
        "on": { "enum": ["load", "idle", "hover", "click", "visible", "scroll", "exit", "gary-click", "time", "event", "scrolling", "near"] },
        "selector": { "type": "string", "minLength": 1, "maxLength": 500 },
        "after": { "type": "number", "minimum": 0, "maximum": 86400 },
        "every": { "type": "number", "minimum": 1, "maximum": 86400 },
        "threshold": { "type": "number", "minimum": 0, "maximum": 1 },
        "event": { "type": "string", "minLength": 1, "maxLength": 100 },
        "count": { "type": "integer", "minimum": 1, "maximum": 100 },
        "distance": { "description": "For \"near\": distance in CSS px between the pointer and the character (default 80).", "type": "number", "minimum": 0, "maximum": 2000 },
        "say": { "description": "A line, or #pool to pick from a line pool.", "type": "string", "minLength": 1, "maxLength": 500 },
        "do": { "$ref": "#/$defs/behaviour" },
        "scene": { "description": "Scene to play. With a list, each firing plays the next scene and the last one repeats.", "oneOf": [{ "$ref": "#/$defs/poolName" }, { "type": "array", "minItems": 1, "maxItems": 20, "items": { "$ref": "#/$defs/poolName" } }] },
        "group": { "description": "Rules with the same group share one escalation step.", "$ref": "#/$defs/poolName" },
        "during": { "description": "Only while this scene plays: shows the line without stopping the scene. Needs \"say\".", "$ref": "#/$defs/poolName" },
        "chance": { "type": "number", "minimum": 0, "maximum": 1 },
        "cooldown": { "type": "number", "minimum": 0, "maximum": 86400 },
        "once": { "type": "boolean" },
        "maxPerSession": { "type": "integer", "minimum": 0 }
      },
      "allOf": [
        { "if": { "properties": { "on": { "enum": ["hover", "visible"] } } }, "then": { "required": ["selector"] } },
        { "if": { "properties": { "on": { "const": "event" } } }, "then": { "required": ["event"] } }
      ]
    }
  }
}
