{
  "schemaVersion": 1,
  "lines": {
    "scrolled": ["Scrolling. Bold choice.", "Wait for me."]
  },
  "entrance": "arrive",
  "scenes": {
    "arrive": [{ "enter": "left", "y": 0.5 }, { "walkTo": { "x": 0.5 } }, { "wait": 0.8 }, { "say": "#hello" }],
    "scrolled": [{ "play": "judge" }, { "say": "#scrolled" }],
    "glance": [{ "play": "judge.pointer" }]
  },
  "triggers": [
    { "on": "scrolling", "scene": "scrolled", "chance": 0.5, "cooldown": 45 },
    { "on": "near", "distance": 60, "scene": "glance", "cooldown": 20 },
    { "on": "gary-click", "count": 1, "scene": "glance", "cooldown": 5 },
    { "on": "idle", "after": 40, "say": "#idle", "cooldown": 90 },
    { "on": "exit", "say": "#exit", "maxPerSession": 1 }
  ],
  "position": { "side": "left", "x": [0.2, 0.8] },
  "dropTo": "here"
}
